{"allowed_files":["docs/sscm-repair-dogfood.txt"],"authority":"NONE","base_candidate_sha":"6edb3a2ac4dd1ce7a2595fe47c5ba8d8c7a47f21","commit_required":true,"evaluation_ref":{"artifact_ref":"run:mission-sscm-01c-live-1:artifacts/evaluation-1.json","disposition":"FAIL","evaluation_id":"eval:ca370a16-a94f-4c23-a5a8-2d4194a50d88","sha256":"17ae6f3b26d4452b0e3f631741e071f80a80270a7b792825bf8fe5cc0ce0dc54"},"mission_id":"mission-sscm-01c-live-1","repair_attempt":1,"required_changes":[{"expected_content":"SSCM_REPAIR_OK\n","file":"docs/sscm-repair-dogfood.txt","finding":"exact-content mismatch for docs/sscm-repair-dogfood.txt: observed sha256 875b389ff915 != expected sha256 f195483e251a"}],"schema_version":"sovereign.sscm-repair-instruction.v0.1","task_id":"task:implement","verification_requirements":["candidate 2 descends from candidate 1","diff candidate1..candidate2 touches only docs/sscm-repair-dogfood.txt","content byte-exact","worktree clean"]}
